{
  "$schema" : "https://unpkg.com/@camunda/element-templates-json-schema@0.1.0/resources/schema.json",
  "name" : "Test",
  "id" : "test",
  "appliesTo" : [ "bpmn:ServiceTask" ],
  "properties" : [ {
    "value" : "external",
    "label" : "Implementation Type",
    "type" : "String",
    "editable" : false,
    "binding" : {
      "type" : "property",
      "name" : "camunda:type"
    }
  }, {
    "value" : "test",
    "label" : "Topic",
    "type" : "String",
    "editable" : false,
    "binding" : {
      "type" : "property",
      "name" : "camunda:topic"
    }
  } ]
}